titles,category
줄리 터너  특사   정권 인권침해 드러내고 주민 삶 개선해야 ,Politics
이정미  사퇴론에  혁신재창당 매듭지을 것 선거연대 열어놔 ,Politics
유승민  윤석열 정부 레임덕 시작 김기현 체제로 총선 힘들어 ,Politics
러 외무장관   일 방북  북러정상회담 후속 논의,Politics
새 헌재 소장에 이종석 재판관 유력 윤 대통령  이르면   일 지명할 듯,Politics
윤재옥  의대 정원 확대 불가피 정부 의료계 대화로 해결해야 ,Politics
조응천  당분간 이재명 체제 유지될듯 여야 도긴개긴 ,Politics
홍익표  국정원 정치개입 사실로 밝혀지면 강력한 조치 취할 것 ,Politics
한 총리  서민 장바구니 물가 안정에 총력 기울여달라 ,Politics
국감서 불붙은 HD현대중공업 페널티 논란    방산 경쟁력 위축 우려 ,Politics
지난해 가장 잘 팔린 과자 아이스크림은  이것 ,Economic
삼성전자    나노급 D램  세대 더블스택 V낸드 개발로 초격차 ,Economic
수입 물가 석달 연속 상승  유가 지켜봐야 ,Economic
껑충 뛴 코픽스 금리에  차주들  금리 언제까지 오르나요  울상,Economic
기아    일 임단협 교섭 재개 노조 파업 유보,Economic
인천경자청  경제자유구역 출범   주년  국제포럼 개최,Economic
 대전에 무슨 일이  미분양 소진율  위 연초 대비      뚝 ,Economic
금감원장  경남은행 PF대출  저희도 반성 금융기관 너무 신뢰 ,Economic
코스피  기관  사자       오름세 코스닥도      상승,Economic
정부합동  지역활력타운 조성 손 맞잡았다,Economic
 의대 정원  증가 폭  두고 막판 고심   당황한 의협 강경대응 예고 뉴스큐 ,Social
차량 파손하고 행인 위협 필리핀 불법체류자 구속영장,Social
 신경계 퇴행성질환 치료  국내 연구진 고분자 나노운반체 개발,Social
서울지하철 멈추나  노조원      파업 찬성 ,Social
핼러윈 파티  이태원 대신 홍대로 몰리나 ,Social
성남시  세계한인비즈니스대회서 수출상담    억 성과,Social
남편에 성매매 들키자  성폭행 당했다  허위 고소    대  유죄,Social
사회초년생 모아 코로나   지원 대출금  억 가로챈 일당,Social
사찰 봉안당서 유품 훔쳐 생활비 유족 두번 울린 절도범,Social
 부닥치겠다 어  어  급발진 의심 사망 도현이의 마지막 음성,Social
코트 꺼내야 하나   아침 기온  도  서리 내리는 곳도 날씨 ,Culture
 주거 불안이 흡연 비만보다 사람을 더 빨리 늙게 한다 ,Culture
 제 의 누누티비 막는다  권익위  저작권 위반 사이트 공익제보,Culture
볼보코리아   년 연속  상품성  위  AS도 유럽 브랜드  위,Culture
BMW   시리즈 신형 가솔린 PHEV 모델 출시,Culture
조선 궁궐 호위군 사열의식  첩종   년 만에 재개   오는   일부터 경복궁,Culture
푸틴 시진핑   일 회담 개막식서 나란히 연설도,World
 일대일로 정상 포럼 내일 개막  부채의 덫  반박 주목 월드리포트 ,World
니시무라 일본 경제산업상  A급 전범 합사 야스쿠니신사 참배,World
     천 명 이스라엘 파병 준비  전투 목적은 아냐 ,World
에콰도르 대통령 보궐선거    세  최연소  노보아 당선,World
가자 남부  일시휴전설   이스라엘  자국민 대피 중  휴전은 없어 ,World
한국은  공짜   일본은   만원  정부  수송기 비용지불 적절   이 팔 전쟁 ,World
 EU  가자지구 민간인 위한 공수작전 예고 이 팔 전쟁 ,World
하마스  텔아비브  예루살렘에 미사일 공격 ,World
 네이버는 법 위 존재  스타트업 혁신 가로채 ,IT
애플 아이폰     서 아이폰  보다 판매     감소 화웨이에 밀려,IT
두바이로 떠난  디지털 수출 개척단    억원 규모 수출 계약,IT
 소상공인 온라인 판매 확대  KT  라이브커머스 지원사업 종료,IT
네오위즈  P의 거짓  글로벌 누적 판매량    만 장 돌파 ,IT
SKB  홍대 T팩토리서 B tv 고객 초청  필모톡 with 한효주  개최,IT
 분리징수   달만에    만가구 KBS 수신료 미납 누적   억원,IT
반려견 산책량까지 측정해준다 갤럭시 스마트태그  출시,IT
